{
  "id": "31",
  "title": "Write apply-pattern.md command",
  "description": "Create command to execute a selected pattern with task-specific parameters. Loads pattern, gathers parameters, verifies pre-conditions, applies template with placeholder replacement, verifies post-conditions, and records pattern usage.",
  "difficulty": 5,
  "status": "Finished",
  "created_date": "2025-12-05",
  "updated_date": "2025-12-05",
  "dependencies": [
    "30"
  ],
  "subtasks": [],
  "parent_task": null,
  "files_affected": [
    "components/pattern-library/commands/apply-pattern.md"
  ],
  "notes": "Created apply-pattern.md command with parameter gathering, pre-condition verification, template application with placeholder replacement, post-condition checklist, and pattern usage tracking."
}