{
  "id": "26",
  "title": "Create run-gate.md command",
  "description": "Create the command to execute a specific validation gate (pre-execution, post-execution, or checkpoint). Takes gate type and task ID as parameters, runs all checks, and returns structured result according to gate-result schema.",
  "difficulty": 4,
  "status": "Finished",
  "created_date": "2025-12-05",
  "updated_date": "2025-12-05",
  "dependencies": [
    "24",
    "25"
  ],
  "subtasks": [],
  "parent_task": null,
  "files_affected": [
    "components/validation-gates/commands/run-gate.md"
  ],
  "notes": "Created run-gate.md command to execute validation gates, perform all checks based on gate type, determine pass/fail status, generate structured result object conforming to schema, and display formatted output to user."
}