{
  "id": "51",
  "title": "Write components.json for data-analytics template",
  "description": "Create templates/data-analytics/components.json defining template metadata: name, version, description, base template, required components (task-management, validation-gates, pattern-library, checkpoint-system), optional components (error-catalog), and included patterns (microsoft-stack/*).",
  "difficulty": 3,
  "status": "Finished",
  "created_date": "2025-12-05",
  "updated_date": "2025-12-05",
  "dependencies": [
    "50"
  ],
  "subtasks": [],
  "parent_task": null,
  "files_affected": [
    "templates/data-analytics/components.json"
  ],
  "notes": "Created components.json for data-analytics template defining: template metadata (v1.0.0), required components (task-management, validation-gates, pattern-library, checkpoint-system), optional components (error-catalog), included Microsoft stack patterns (4 patterns), customizations structure (context/reference/commands), detection rules (high/medium confidence keywords), technology focus (Fabric/Power BI/DAX/PQ), typical project structure, key patterns, and common errors prevented."
}