{
  "id": "48",
  "title": "Update breakdown.md with pattern suggestions",
  "description": "Enhance components/task-management/commands/breakdown.md to call find-pattern.md when breaking down tasks and suggest relevant patterns for subtasks. Helps guide implementation by recommending proven approaches.",
  "difficulty": 4,
  "status": "Finished",
  "created_date": "2025-12-05",
  "updated_date": "2025-12-05",
  "dependencies": [
    "31"
  ],
  "subtasks": [],
  "parent_task": null,
  "files_affected": [
    "components/task-management/commands/breakdown.md"
  ],
  "notes": "Enhanced breakdown.md with pattern suggestion integration. Added step 2.5 to call find-pattern.md when breaking down tasks, suggest relevant patterns for parent task and each subtask, display pattern recommendations to user, and include pattern suggestions in subtask notes. Helps guide implementation by recommending proven approaches during task decomposition."
}