{
  "id": "3",
  "title": "Create Research/Analysis template",
  "description": "Build out templates/research-analysis/ with README.md, components.json, and customizations/ including literature review structure, hypothesis tracking, experiment design patterns, data analysis workflows, and citation management patterns.",
  "difficulty": 6,
  "status": "Finished",
  "created_date": "2025-11-15",
  "updated_date": "2025-11-16",
  "dependencies": ["1"],
  "subtasks": [],
  "parent_task": null,
  "notes": "Completed: Created comprehensive research-analysis template with README.md, components.json, and all customization files including literature review structure, hypothesis tracking, experiment design patterns, data analysis workflows (2 workflow files), citation management, data analysis checklist, and statistical methods guide."
}
