{
  "id": "6",
  "title": "Create context documentation for this repo",
  "description": "Create .claude/context/overview.md explaining this repository's purpose, structure, and how to work with it. Document the component composition pattern and template authoring guidelines.",
  "difficulty": 3,
  "status": "Pending",
  "created_date": "2025-11-15",
  "dependencies": ["1"],
  "subtasks": [],
  "parent_task": null,
  "notes": "Helps Claude understand this repo when working on improvements"
}
